Literature added,,,,,,,,,,,,,,,,,,,,,,,,,
"156. Smith, F.A. 1991. Nutritional ecology and body size of Neotoma populations. PhD dissertation, University of California.",,,,,,,,,,,,,,,,,,,,,,,,,
"157. Smith, F.A. 1992 Evolution of body size among woodrats from Baja California, Mexico. Functional Ecology, 6:265-273.",,,,,,,,,,,,,,,,,,,,,,,,,
"158. Smith, FA, Bestelmeyer, B.T., Biardi, J. and Strong, M. 1993. Anthropgenic extinction of the endemic woodrat Netoma bunkeri Burt. Biodiversity Letters, 1:149-155.",,,,,,,,,,,,,,,,,,,,,,,,,
"159. Choate, J,. 2002. in litt.",,,,,,,,,,,,,,,,,,,,,,,,,
"160. Evans, R.H. Anesthesia and restraint of raccoons and relatives (Carnivora, Procyonidae). In: Zoological Restraint and Anesthesia, (D. Heard, ed.), Ithaca: International Veterinary Information Service, in press (preprint available at http://www.ivis.org/special_books/Heard/toc.asp)",,,,,,,,,,,,,,,,,,,,,,,,,
"161. Wilson, D. E. and Ruff, S. 1999. The Smithsonian book of North American mammals. Washington, D.C.: Smithsonian Institution Press.",,,,,,,,,,,,,,,,,,,,,,,,,
"162. Smithers, R. H. N. 1971. The mammals of Botswana. Museum Memoir No. 4, The Trustees of the national Museums of Rodesia. Printed by Mardon Printers Ltd., Salisbury Rhodesia. 340",,,,,,,,,,,,,,,,,,,,,,,,,
"163. Hutterer, R. and Happold, D. C. D. 1983. The shrews of Nigeria (Mammalia: Soricidae). Bonner Zoologische Monographien, Nr. 18. Zoologisches Forschungsinstitut Und Museum Alexander Koenig, Bonn. 79",,,,,,,,,,,,,,,,,,,,,,,,,
"164. Davies, Glyn, Matt Heydon, Nigel Leader-Williams, John MacKinnon, and Helen Newing. 2001. The effects of logging on forest ungulates. Ch. 5 (www.earthscape.org/r3/ES14447/fimb_ch5.pdf ) pg. 93-124 in: The Cutting Edge: Conserving Wildlife in Logged Tropical Forests (Robert A. Fimbel, John G. Robinson, Alejandro eds. Grajal, eds.). Columbia university press. ",,,,,,,,,,,,,,,,,,,,,,,,,
"165. Brook, B. W., and M. J. S. Bowman. 2004. The uncertain blitzkrieg of Pleistocene megafauna. Journal of Biogeography 31:517-523.",,,,,,,,,,,,,,,,,,,,,,,,,
"166. Daniel, M. J. 1990. New Zealand long-tailed bat. 117-122 IN: The handbook of New Zealand Mammals (C. M. King, ed.). Oxford University Press, Oxford. 600",,,,,,,,,,,,,,,,,,,,,,,,,
"167. Zhang, Y., Zhang, Z., and Liu, J. 2003. Burrowing rodents as ecosystem engineers: the ecology and management of plateau zokors Myospalax fontanierii in alpine meadow ecosystems on the Tibetan Plateau. Mammal Rev . Volume 33, No. 3, 284–294. ",,,,,,,,,,,,,,,,,,,,,,,,,
"168. Gombobaatar, S., Sumiya, D., Samiya, R., Bayarlkhagva, D. 2003. Current research and future trends of cooperative raptor research between Mongolia and Korea. Symposium on Cooperation between Korea and Mongolia for Wildlife Conservation.",,,,,,,,,,,,,,,,,,,,,,,,,
"169. Nechay, Gabor. 2000. Status of Hamsters: Cricetus cricetus, Cricetus migratorius, Mesocricetus Newtoni and other hamster species in Europe     Nature and Environment Series, No. 106 1-73.",,,,,,,,,,,,,,,,,,,,,,,,,
"170. Liu, J.S., Wang, D.H., Sun, R.Y. Metabolism and thermoregulation in striped hamsters(Cricetulus barabensis)from the Northeast of China. Acta Zoologica Sinica, Aug. 2003, 49(4):451 - 457",,,,,,,,,,,,,,,,,,,,,,,,,
"171. Koh, H.S., Chun, T.Y., Yoo, H.S., Zhang, Y., Wang, J., Zhang, M., and Wu, C.H. 2001. Mitochondrial Cytochrome b Gene Sequence Diversity in the Korean Hare, Lepus coreanus Thomas (Mammalia, Lagomorpha) Biochemical Genetics 39 (11-12): 417-429, December 2001",,,,,,,,,,,,,,,,,,,,,,,,,
"172. Christiane Mauget, Robert Mauget, and Antoine Sempéré. 1999. Energy expenditure in European roe deer fawns during the suckling period and its relationship with maternal reproductive cost. Can. J. Zool. 77: 389–396.",,,,,,,,,,,,,,,,,,,,,,,,,
"173. LI, J.S., Song,Y.L. and Zeng, Z.G. . 2003. Elevational gradients of small mammal diversity on the northern slopes of Mt. Qilian, China Global Ecology & Biogeography (2003) 12 , 449–460 ",,,,,,,,,,,,,,,,,,,,,,,,,
174. www.iiasa.ac.at/~sendzim/MammalDataSets/ Trop%20Wet%20Forest%20Mamm.xls - Supplemental Result,,,,,,,,,,,,,,,,,,,,,,,,,
"175. Steinlechner, S. 1998. Djungarian hamster and/or Siberian hamster: who is who? Reprinted from European Pineal Society NEWS, 1998, number 38 (April): 7-11",,,,,,,,,,,,,,,,,,,,,,,,,
"176. Cofikun, Y., Ulutürk, S. 2003. Observations on the Mole Vole, Ellobius lutescensThomas 1897, (Mammalia: Rodentia) in Turkey Research Article Turk J Zool 27, 81-87",,,,,,,,,,,,,,,,,,,,,,,,,
"177. Charudutt Mishra1,2, Sipke E. Van Wieren1, Ignas M. A. Heitkönig1 and Herbert H. T. Prins1 (2002) A theoretical analysis of competitive exclusion in a Trans-Himalayan large-herbivore assemblage Animal Conservation 5, 251–258 ©2002 The Zoological Society of London ",,,,,,,,,,,,,,,,,,,,,,,,,
"178. Juskaitis, Rimvydas. 1999. Pygmy field mouse (Apodemus uralensis pallas): a new mammal species in lithuania. Acta Zoologica lituanica. Biodiversity. 9: 118-119.",,,,,,,,,,,,,,,,,,,,,,,,,
"179. Chevret, , Jenkins, , and Catzeflis, F. 2003. Evolutionary systematics of the Indian mouse Mus famulus Bonhote, 1898: molecular (DNA/DNA hybridization and 12S rRNA sequences) and morphological evidence Zoological Journal of the Linnean Society , 137, 385–401.",,,,,,,,,,,,,,,,,,,,,,,,,
"180. Ochocinska, D. and Taylor, J. R. E. 2003. Bergmann's rule in shrews: geographical variation of body size in Palearctic Sorex species. Biological Journal of the Linnean Society. 78. 365-381.",,,,,,,,,,,,,,,,,,,,,,,,,
"181. Barrioneuvo, F. J., Zurita, F., Burgos, M. and Jimenez, R. 2004. Developmental stages and growth rate of the mole Talpa occidentalis (Insectivora, Mammalia). Journal of Mammalogy. 85:120-125. ",,,,,,,,,,,,,,,,,,,,,,,,,
"182. Sara, M. and Morand, S. 2002. Island incidence and mainland population density: mammals from Mediterranean islands. Diversity and Distributions. 8:1-9.",,,,,,,,,,,,,,,,,,,,,,,,,
"183. Alves, C., and Rocha, A. 2003. Environmental factors have little influence on the reproductive activity of the Iberian hare (Lepus granatensis). Wildlife Research. 30:639-647.",,,,,,,,,,,,,,,,,,,,,,,,,
"184. Vinogradov, A.E., Anatskaya, O.V., and Kudryavtsev, B. N. 2001. Relationship of hepatocyte ploidy levels with body size and growth rate in mammals. Genome 44: 350-360.",,,,,,,,,,,,,,,,,,,,,,,,,
"185. Sutou, S. Mitsui, Y., Tsuchiya, K. 2001. Sex determination without the Y chromosome in two japanese rodents Tokudaia osimensis osimensis and Tokudaia osimensis s Mammalian Genome. 12:17-21. ",,,,,,,,,,,,,,,,,,,,,,,,,
"186. Hoffmann, R.S . 1996. A research information system for mammals with Palaearctic examples. in: Conserving China's Biodiversity (II) (PETER Johan Schei, WANG Sung and XIE Yan eds.). China Environmental Science Press. Beijing. 231-246p",,,,,,,,,,,,,,,,,,,,,,,,,
"187. Tchabovsky, A. and Bazykin, G. 2004. Females delay dispersal and breeding in a solitary gerbil, Meriones tamariscinus. Journal of Mammalogy. 85:105-112.",,,,,,,,,,,,,,,,,,,,,,,,,
"188. Degen, A. A., Kam. M, Khokhlova, I. S., Krasnov, B. R., and Barraclough, T. G. 1998. Average daily metabolic rate of rodents: habitat and dietary comparisons. Functional Ecology 12:63-73.",,,,,,,,,,,,,,,,,,,,,,,,,
"189. Qolak, E., Yigit, N., and Sozen, M. 1998. A study on taxonomic status of Microtus subterraneus (de Selys Longchamps, 1836) and Microtus majori Thomas, 1906 (Mammalia: Rodentia) in Turkey. Turkey Journal of Zoology. 22: 119-129.",,,,,,,,,,,,,,,,,,,,,,,,,
"190. Haim, A., Shabtay, A. and Arad, Z. 1999. The thermoregulatory and metabolic responses to photoperiod manipulations of the Macedonian mouse (Mus macedonicus), a post-fire invader. Journal of Thermal Biology 24: 279-286.",,,,,,,,,,,,,,,,,,,,,,,,,
"191. Yigit, N. Qolak, E. Qolak, R., Ozkan, B. and Ozkurt, S. 2003. ON THE TURKISH POPULATIONS OF DRYOMYS NITEDULA (PALLAS, 1779) AND DRYOMYS LANIGER FELTEN AND STORCH, 1968 (MAMMALIA: RODENTIA). Acta Zoologica Academiae Scientiarum Hungaricae 49 (Suppl. 1), 147-158. Available at: http://216.239.57.104/search?q=cache:2mznwwa3v-8J:zoo.zoo.nhmus.hu/publication/actazool/49/S1/yigit.pdf+Dryomys+laniger+weight&hl=en",,,,,,,,,,,,,,,,,,,,,,,,,
"192. ""Desert Dormouse."" Encyclopædia Britannica. 2004. Encyclopædia Britannica Premium Service. 26 July 200 <http://www.britannica.com/eb/article?eu=68394>.",,,,,,,,,,,,,,,,,,,,,,,,,
"193. Zahler, 1996. Rediscovery of the woolly flying squirrel (Eupetaurus cinereus). Journal of Mammalogy. 77:54-57.",,,,,,,,,,,,,,,,,,,,,,,,,
"194. Iriarte-Diaz, J. 2002. Differential scaling of locomotor performance in small and large terrestrial mammals. The Journal of Experimental Biology. 205:2897-2908.",,,,,,,,,,,,,,,,,,,,,,,,,
"195. Yigit, N. Qolak, E., Sozen, M. and Ozkurt, S. 2000. A study on the hibernation of Spermophilus xanthoprymnus (Bennet, 1835) (Mammalia: Rodentia) in Turkey. Turkey Journal of Zoology. 24: 87-93.",,,,,,,,,,,,,,,,,,,,,,,,,
"196. Woodland savanah mammals (excel file) Available at: 
www.iiasa.ac.at/~sendzim/MammalDataSets/ Woodland%20Savanna%20Mamm.xls",,,,,,,,,,,,,,,,,,,,,,,,,
"197. Panteleev, A. 2002. Justified predictions about new (different) species comfirm the theory. Russian Journal of Ecology 34:141-143.",,,,,,,,,,,,,,,,,,,,,,,,,
"198. Dippenaar, M.J. 1995. Geographic variation in Myosorex longicaudatus (soricidae) in the Southern Cape Province, South Africa. Journal of Mammalogy 76:1071-1087.",,,,,,,,,,,,,,,,,,,,,,,,,
"199. Aeschimann, J., Bourquin, L., Engels, B., Thomas, C. and Vogel, 1998. Comparative winter thermoregulation and body temperature in three sympatric Apodemus species (A. alpicola, A. flavicollis, and A. sylvaticus). Z. Säugetierkunde. 63. 273-284. ",,,,,,,,,,,,,,,,,,,,,,,,,
"200. Yeboah, S. and Dakwa, K. B. 2002. Aspects of the feeding habits and reproductive biology of the Ghana mole-rat Cryptomys zechi (Rodentia, Bathyergidae). African Journal of Ecology. 40:110-119.",,,,,,,,,,,,,,,,,,,,,,,,,
"201. Lacas. S., Allevard, A. M., Ag'Atteinine, S., Gallo-Bona, N., Gauquelin-Koch, G., Hardin-Pouzet, H., Gharib, C., Sicard, B., and Maurel, D. 2000. Cardiac Natriuretic peptide response to water restriction in the hormonal adaptation of two semidesert rodents from West Africa (Steatomys caurinus, Taterillus gracilis). General and Comparative Endocrinology. 120:176-189.",,,,,,,,,,,,,,,,,,,,,,,,,
"202. Key, N. Cervus alfredi (Visayan spotted deer). [28 July 2004; online] Available at : http://animaldiversity.ummz.umich.edu/site/accounts/information/Cervus_alfredi.html",,,,,,,,,,,,,,,,,,,,,,,,,
"203. Edmison, N. Melogale everetti (Everett's ferret-badger). [29 July 2004; online] Available at: http://animaldiversity.ummz.umich.edu/site/accounts/information/Melogale_everetti.html.",,,,,,,,,,,,,,,,,,,,,,,,,
"204. Costa, D. and Gales, N. J. 2000. Foraging energetics and diving behavior of lactating New Zealand sea lions, Phocarctos hookeri. The Journal of Experimental Biology. 203: 3655-3665.",,,,,,,,,,,,,,,,,,,,,,,,,
"205. Cockrum, E. L. 1977. Status of the hairy footed gerbil, Gerbillus latastei Thomas and Trouessart. Mammalia 41: 75-80.",,,,,,,,,,,,,,,,,,,,,,,,,
"206. Pearch, M. J., Bates, J. J., Magin, C. 2001. A review of the small mammal fauna of Djibouti and the results of a recent survey. Mammalia 65: 387-409",,,,,,,,,,,,,,,,,,,,,,,,,
"207. Dieterlen, F. and Van Der Straeten, E. 1984. New specimens of Malacomys vershureni from Eastern Zaïre (Mammalia, Muridae). Revue de Zoologie Africaine. 98(4): 861-868.",,,,,,,,,,,,,,,,,,,,,,,,,
"208. Lazell, J., Lu, W., Xia, W., Li, S. Y., and Smith, A. 1995. Status of the Hainan Hare. Species 25: Available at: http://www.ualberta.ca/~dhik/lsg/speciesreports.htm#December%201995,%20Number%2025.",,,,,,,,,,,,,,,,,,,,,,,,,
"209. McFarlane, D. A. 1999. A note on dimorphism in Nesophontes edithae (Mammalia: Insectivora), an extinct island-shrew from Puerto Rico. Caribbean Journal of Science. 35:142-143.",,,,,,,,,,,,,,,,,,,,,,,,,
"210. Mathieson, L. 2002. ""Pentalagus furnessi"" (On-line), Animal Diversity Web. Accessed July 30, 2004 at http://animaldiversity.ummz.umich.edu/site/accounts/information/Pentalagus_furnessi.html.",,,,,,,,,,,,,,,,,,,,,,,,,
"211. Rowe, N. 1996. The Pictorial Guide to the Living Primates. Pogonias Press: East Hampton, New York.",,,,,,,,,,,,,,,,,,,,,,,,,
"212. Verheyen, W. N. 1964. Description of Lophuromys rahmia new species of Murdiae from Central Africa. Revue de Zollogie et de Botanique Africaines 28: 206-213",,,,,,,,,,,,,,,,,,,,,,,,,
"213. Kitchener, A.C., Clegg, T., Thompson, N. M. J., Wiik, H. and MacDonald, A. A. 1993. First records of the Malay civit, Viverra tangalunga Gray, 1832, on Seram with notes on the Seram bandicoot Rhynchomeles prattorum Thomas, 1920. Z. Säugetierkunde 58: 378-380.",,,,,,,,,,,,,,,,,,,,,,,,,
"214. Dobigny, G., Gradjon, L. Aniskin, V. Ba, K. and Volobouev, V. 2003. A new sibling species of Taterillus (Muridae, Gerbillinae) from West Africa. Mammalian Biology 68:299-316.",,,,,,,,,,,,,,,,,,,,,,,,,
"215. Burton, J. A., and Pearson, B. 1987. The collins guide to the rare mammals of the world. The Stephen Greene Press. Lexington, Massachusetts. 240",,,,,,,,,,,,,,,,,,,,,,,,,
"216. White, C. R., and Seymour, R. S. 2003. Mammalian basal metabolic rate is proportional to body mass^2/3. PNAS 100:4046-4049.",,,,,,,,,,,,,,,,,,,,,,,,,
"217. Yom-Tov, Y., and Dayan, T. 1996. Body mass overlap and interspecific interference competition among desert gerbils? Oikos 75:536-538.",,,,,,,,,,,,,,,,,,,,,,,,,
"218. McCain, C. M. and R. M. Timm. Sigmodontomys aphrastus (Rodentia: Muridae): Re-evaluation and re-description of the species. For Submittal to Proceedings of the Biological Society of Washington.",,,,,,,,,,,,,,,,,,,,,,,,,
"219. Dos Reis, S. F. and L. M. Pessoa. 2004. Thrichomys apereoides. Mammalian Species No. 741, 1-5. The American Society of Mammalogists.",,,,,,,,,,,,,,,,,,,,,,,,,
"220. Gillihan, S. W. and K. R. Foresman. 2004. Sorex vagrans. Mammalian Species no. 744: 1-5. The American Society of Mammalogists. ",,,,,,,,,,,,,,,,,,,,,,,,,
"221. Herron, M. D. and J. M. Waterman. 2004. Xerus erythropus. Mammalian Species No. 748:1-4. The American Society of Mammalogists.",,,,,,,,,,,,,,,,,,,,,,,,,
"222. Woodman, N., and R. M. Timm. 1999. Geographic variation and evolutionary relationships among broad-clawed shrews of the Cryptotis goldmani-group (Mammalia: Insectivora: Soricidae). Fieldiana: Zoology (new series) 91:1–35.",,,,,,,,,,,,,,,,,,,,,,,,,
"223. Pine, R. H., N. Woodman, and R. M. Timm. 2002. Rediscovery of Enders’s small-eared shrew, Cryptotis endersi (Insectivora: Soricidae), with a redescription of the species. Mammalian Biology 67:372 –377.",,,,,,,,,,,,,,,,,,,,,,,,,
"224. Woodman, N. 2000. Cryptotis merriami Choate in Costa Rica: syntopy with Cryptotis nigrescens (Allen) and possible character displacement. Caribbean Journal of Science 36(3–4): 289–299. ",,,,,,,,,,,,,,,,,,,,,,,,,
"225. Woodman, N., and R. M. Timm. 1993. Intraspecific and interspecific variation in the Cryptotis nigrescens species complex of small-eared shrews (Insectivora: Soricidae), with the description of a new species from Colombia. Fieldiana: Zoology (new series), 74:1–30.",,,,,,,,,,,,,,,,,,,,,,,,,
"226. Goodman, S.M., Hutterer, R., and R. Ngnegueu. 2001. A report on the community of shrews (Mammalia: Soricidae) occurrring in the Minkebe Forest, northeastern Gabon. Mammalian Biology 66:22-34.",,,,,,,,,,,,,,,,,,,,,,,,,
"227. OHDACHI, A. 1992. Female reproduction in three species of Sorex in Hokkaido, Japan. Journal of Mammalogy 73:455-457.",,,,,,,,,,,,,,,,,,,,,,,,,
"228. Withers, C. 2000. Metablic physiology of Notoryctes caurinus. Australian Journal of Zoology 48:241-258.",,,,,,,,,,,,,,,,,,,,,,,,,
229. www.animalinfo.org/species/crypzyli.htm (August 2004),,,,,,,,,,,,,,,,,,,,,,,,,
230. www.animalinfo.org/species/chryvisa.htm (August 2004),,,,,,,,,,,,,,,,,,,,,,,,,
231. Www. Columbia.edu/~kj2107/research/databases/jonesbraindata.htm (August 2004),,,,,,,,,,,,,,,,,,,,,,,,,
232. Www.it is.usda.gov/servlet/singlerpt/singlerpt?search_topic=aus (August 2004),,,,,,,,,,,,,,,,,,,,,,,,,
"233. Jass, C. N. and Mead, J. I. 2004. Capricornis crispus. Mammalian Species No. 750, 1-10. The American Society of Mammalogists.",,,,,,,,,,,,,,,,,,,,,,,,,
"234. Waterman, J. M. and Herron, M. D. 2004. Xerus princeps. Mammalian Species No. 751, 1-3. The American Society of Mammalogists.",,,,,,,,,,,,,,,,,,,,,,,,,
"235. Haynes, M. A. and Lee Jr., T. E. 2004. Artibeus obscurus. Mammalian Species No. 752, 1-5. The American Society of Mammalogists.",,,,,,,,,,,,,,,,,,,,,,,,,
"236. Cain III, J. W., Krausman, R. and Germaine, H. L. 2004. Antidorcas marsupialis. Mammalian Species No. 753, 1-7. The American Society of Mammalogists.",,,,,,,,,,,,,,,,,,,,,,,,,
"237. Hunt, J. L., Morris, J. E., and Best, T. L. 2004. Nyctomys sumichrasti. Mammalian Species No. 754, 1-6. The American Society of Mammalogists.",,,,,,,,,,,,,,,,,,,,,,,,,
"238. Maston, J. O., and McCarthy, T. J. 2004. Sturnira mordax. Mammalian Species No. 755, 1-3. The American Society of Mammalogists.",,,,,,,,,,,,,,,,,,,,,,,,,
"239. Bennett, N. C. and Jarvis, J. U. M. 2004. Cryptomys damarensis. Mammalian Species No. 756, 1-5. The American Society of Mammalogists.",,,,,,,,,,,,,,,,,,,,,,,,,
"240. Hwang, Y. T. and Lariviére, S. 2004. Mydays marchei. Mammalian Species No. 757, 1-3. The American Society of Mammalogists.",,,,,,,,,,,,,,,,,,,,,,,,,
"241. Spotorno, A. E., Zuleta, C. A., Valladares, J. , Deane, A. L., and Jiménez, J. E. 2004. Chinchilla laniger. Mammalian Species No. 758, 1-9. The American Society of Mammalogists.",,,,,,,,,,,,,,,,,,,,,,,,,
"242. Woodman, N. And Díaz de Pascual, A. 2004. Cryptotis meridensis. Mammalian Species No. 761, 1-5. The American Society of Mammalogists.",,,,,,,,,,,,,,,,,,,,,,,,,
"243. Stanley, W.T. and Olson, L. E. 2005. Phylogeny, phylogeography, and geographic variation of Sylvisorex howelli (Family Soricidae), an endemic shrew of the Eastern Arc Mountains, Tanzania. Journal of Zoology (in press)",,,,,,,,,,,,,,,,,,,,,,,,,
"244. Goodman, S. M., and Hutterer, R. 2004. A report on the shrews (Mammalia: Soricidae) of Monts Doudou, Gabon: Elevational Distribution and preliminary insights into their ecology. California Academy of Sciences Memoir. 28: 93-105.",,,,,,,,,,,,,,,,,,,,,,,,,
"245. Aguirre, L. F., Herrel, A., van Damme, R. and Matthysen, E. 2002. Ecomorphological analysis of trophic niche partitioning in a tropical savannah bat community.",,,,,,,,,,,,,,,,,,,,,,,,,
"246. Lim, B. K. and Engstrom, M. D. 2001. Bat community structure at Iwokrama Guyana. Journal of Tropical Ecology. 17:647-665.",,,,,,,,,,,,,,,,,,,,,,,,,
"247. McCarthy, T. J., Albuja V., L. And Manzano, I. 2000. Rediscovery of the brown sac-wing bat Balantiopteryx infusca (Thomas, 1897), in Ecuador. Journal of Mammalogy. 81: 958-961.",,,,,,,,,,,,,,,,,,,,,,,,,
"248. Dávalos, L. M. 2004. New Chocoan species of Lonchophylla (Chiroptera: Phyllostomidae). American Museum Novitates. Number 3426:1-14.",,,,,,,,,,,,,,,,,,,,,,,,,
"249. Fenton, M. B., Bernard, E., Bouchard, S., Hollis, L., Johnston, D. S., Lausen, C. L., Ratcliffe, J. M., Riskin, D. K., Taylor, J. R., and Zigouris, J. 2001. The bat fauna of Lamanai, Belize: roosts and trophic roles. Journal of Tropical Ecology. 17:511-524.",,,,,,,,,,,,,,,,,,,,,,,,,
"250. Ibañez, C. Ramo, C. and Busto, B. 1992. Notes on the food habits of the black and white owl. Condor 94:529-531.",,,,,,,,,,,,,,,,,,,,,,,,,
"251. Canaals, M. Iriarte-Díaz, J., Olivares, R., and Novoa, F. 2001. Comparison of the wing morphology of Tadarida brasiliensis (Chiroptera: Molossidae) and Myotic chiloensis (Chiroptera: Vespertilionidae) as representatives of two flight patterns. Revista Chilena de Historia Natural. 74: 699-704",,,,,,,,,,,,,,,,,,,,,,,,,
"252. Riskin, D. K. and Fenton, M. B. 2001. Sticking ability in Spix's disk-winged bat, Thyroptera tricolor (Microchioptera: Thyropteridae). Canadian Journal of Zoology 79:2261-2267.",,,,,,,,,,,,,,,,,,,,,,,,,
"253. Flannery, T. 1995a. Mammals of the South-West Pacific & Moluccan Islands. Comstock/Cornell, Ithaca NY, USA",,,,,,,,,,,,,,,,,,,,,,,,,
"254. Webster, W. D. and Knox Jr., J. J. 1983. Artibeus hirsutus and Artibeus inopinatus. Mammalian Species No. 199:1-3. The American Society of Mammalogists.",,,,,,,,,,,,,,,,,,,,,,,,,
"255. Bouchard, S. 2001. Chaerephon ansorgei. Mammalian Species No. 660:1-3. The American Society of Mammalogists.",,,,,,,,,,,,,,,,,,,,,,,,,
"256. Young, R. A. and Ford, G. I. 2000. Bat fauna of a semi-arid environment in central western Queensland, Australia. Wildlife Research. 27:203-215.",,,,,,,,,,,,,,,,,,,,,,,,,
"257. Yasuma, S., Andau, M., Apin, L. Tuh Yit Yu, F., and Kimsui, L. 2003. Identification keys to the mammals of Borneo. Bornean Biodiversity & Ecosystem conservation programme in Sabah. Park Management Component BBEC Programme.",,,,,,,,,,,,,,,,,,,,,,,,,
"258. Kitchener, D. J., and Maharadtunkamsi. 1996. Geographic variation in morphology of Cynopterus nusatenggara (Chiroptera; Pteropodidae) in south-eastern Indonesia and description of two new subspecies. Mammalia. Vol:60, page:255-276. 1996 1996. ",,,,,,,,,,,,,,,,,,,,,,,,,
"259. Bonaccorso, F. J. 1998. Bats of Papua New Guinea. Conservation International Tropical Field guide Series 2. Conservation International, Washington D. C.",,,,,,,,,,,,,,,,,,,,,,,,,
"260. Taylor, 1998. The smaller mammals of KwaZulu-Natal. University of Natal Press. Pietermaritzburg",,,,,,,,,,,,,,,,,,,,,,,,,
"261. Goodwin, G. G. and Greenhall, A. M. 1961. A review of the bats of Trinidad and Tobago: Descriptions, rabies infection, and ecology. Bulletin of the American Museum of Natural History. 122:191-301.",,,,,,,,,,,,,,,,,,,,,,,,,
"262. Harrison, D. L., and Bates, J. J. 1991. The mammals of Arabia. Second edition. Harrison Zoological Museum. Sevenoaks, Kent, England.",,,,,,,,,,,,,,,,,,,,,,,,,
"263. Rosevear, D. R. 1969. The rodens of west Africa. The British Museum (Natural History). London, England.",,,,,,,,,,,,,,,,,,,,,,,,,
"264. Álvarez-Castañeda, S. T. 2005. Peromyscus winkelmanni. Mammalian Species No. 765:1-3. The American Society of Mammalogists.",,,,,,,,,,,,,,,,,,,,,,,,,
"265. Mantooth, S. J. and Best, T. L. 2005. Chaetodipus penicillatus. Mammalian Species No. 767:1-7. The American Society of Mammalogists.",,,,,,,,,,,,,,,,,,,,,,,,,
"266. Krausman, R. and Morales, S. M. 2005. Acinonyx jubatus. Mammalian Species No. 771:1-6. The American Society of Mammalogists.",,,,,,,,,,,,,,,,,,,,,,,,,
"267. Adam, J. Lobodon carcinophaga. Mammalian Species No. 772:1-14. The American Society of Mammalogists.",,,,,,,,,,,,,,,,,,,,,,,,,
"268. Álvarez-Castañeda, S. T., and Méndez, L. 2005. Peromyscus madrensis. Mammalian Species No. 774:1-3. The American Society of Mammalogists.",,,,,,,,,,,,,,,,,,,,,,,,,
"269. Barnett, A. A. 2005. Cacajao melanocephalus. Mammalian Species No. 776:1-6. The American Society of Mammalogists.",,,,,,,,,,,,,,,,,,,,,,,,,
"270. Rosi, M. I., Cona, M. I., Roig, V. G., Massarini, A. I., and Verzi, D. H. 2005. Ctenomys mendocinus. Mammalian Species No. 777:1-6. The American Society of Mammalogists.",,,,,,,,,,,,,,,,,,,,,,,,,
"271. Mancina, C.A. 2005. Pteronotus macleayii. Mammalian Species No. 778: 1-3. The American Society of Mammalogists.",,,,,,,,,,,,,,,,,,,,,,,,,
"272. Gorsuch, W. A., and Lariviére, S. 2005. Vormela peregusna. Mammalian Species No. 779:1-5. The American Society of Mammalogists.",,,,,,,,,,,,,,,,,,,,,,,,,
"273. Barreto, G. R., and García-Rangel, S. 2005. Holochilus sciureus. Mammalian Species No. 780:1-5. The American Society of Mammalogists.",,,,,,,,,,,,,,,,,,,,,,,,,
"274. Skurski, D. A., and Waterman, J. M. 2005. Xerus inauris. Mammalian Species No. 781:1-4. The American Society of Mammalogists",,,,,,,,,,,,,,,,,,,,,,,,,
"275. Yamada, F. and Cervantes, F. A. 2005. Pentalagus furnessi. Mammalian Species No. 782:1-5. The American Society of Mammalogists.",,,,,,,,,,,,,,,,,,,,,,,,,
"276. De Mello Beisiegel, B. and Zuercher, G. L. 2005. Speothos venaticus. Mammalian Species No. 783:1-6. The American Society of Mammalogists.",,,,,,,,,,,,,,,,,,,,,,,,,
"277. Lausen, C. L. and Barclay, R. M. R. 2005. Pipistrellus nanus. Mammalian Species No. 784:1-7. The American Society of Mammalogists",,,,,,,,,,,,,,,,,,,,,,,,,
"278. Hernández-Meza, B., Domínguez-Castellanos, Y. and Ortega, J. 2005. Mammalian Species No. 785:1-3. The American Society of Mammalogists",,,,,,,,,,,,,,,,,,,,,,,,,
"279. Hwang, Y. T., and Lariviére, S. 2005. Lutrogale perspicillata. Mammalian Species No. 786:1-4. The American Society of Mammalogists",,,,,,,,,,,,,,,,,,,,,,,,,
"280. Sherwin, R. E. and Gannon, W. L. 2005. Ariteus flavescens. Mammalian Species No. 787:1-3. The American Society of Mammalogists",,,,,,,,,,,,,,,,,,,,,,,,,
"281. Lim, B. K., and Engstrom, M. D. 2001. Species diversity of bats (Mammalia: Chiroptera) in Iwokrama Forest, Guyana, and the Guianan subregion: implications for conservation. Biodiversity and Conservation 10:613-657.",,,,,,,,,,,,,,,,,,,,,,,,,
"282. Webala, W., Oguge, N. O. and Bekele, A. 2004. Bat species diversity and distribution in three vegetation communities of Meru National Park, Kenya. African Journal of Ecology 42: 171-179.",,,,,,,,,,,,,,,,,,,,,,,,,
"283. Wang, J-M, Zhang, Y-M, Wang, D-H. 2006. Seasonal thermogenesis and body mass regulation in plateau pikas (Ochotona curzoniae).",,,,,,,,,,,,,,,,,,,,,,,,,
284. Van Valkenburgh et al. 1990. Journal of Vertebrate Paleontology 10(4). ,,,,,,,,,,,,,,,,,,,,,,,,,
"285. Johnson, W.E. et al. 2006. The Late Miocene radiation of modern Felidae: A genetic assessment (abstract). Science 311 (5757): 73–77",,,,,,,,,,,,,,,,,,,,,,,,,
"286. Eric Scott, pers. Comm.; Christian Barron-Ortiz, pers. Comm. June 2014",,,,,,,,,,,,,,,,,,,,,,,,,
"287. Leconte, J.L. 1848. American Journal of Science and Arts, second series V:102-106.",,,,,,,,,,,,,,,,,,,,,,,,,
