Literature added,,,,,,,,,,,,,,,,,,,,,,,,,
"1. Anderson, E. 1984. Who’s who in the Pleistocene: A mammalian bestiary. In Quaternary extinctions: a prehistoric revolution (S. Martin and R.G. Klein, eds.), 40-89. Tucson, AZ: University of Arizona Press.",,,,,,,,,,,,,,,,,,,,,,,,,
"2. Klein, R.G. 1984. Mammalian extinctions and stone age people in Africa. In Quaternary extinctions: a prehistoric revolution (S. Martin and R.G. Klein, eds.), 553-573. Tucson, AZ: University of Arizona Press.",,,,,,,,,,,,,,,,,,,,,,,,,
"3. Flannery, T. and Schouten, 2001. A gap in nature: discovering the world’s extinct animals, New York, NY: Atlantic Monthly Press.",,,,,,,,,,,,,,,,,,,,,,,,,
"4. MacPhee, R.D.E. and Flemming, C. 1999. Requiem æternam: The last five hundred years of mammalian species extinctions. In Extinctions in near time: causes, contexts, and consequences (R.D.E. MacPhee, ed.), 333-372. New York: Kluwer Academic/Plenum Press.",,,,,,,,,,,,,,,,,,,,,,,,,
"5. Milewski, A.V. and Diamond, R.E. 2000. Why are very large herbivores absent from Australia? A new theory of micronutrients. Journal of Biogeography, 27: 957-978.",,,,,,,,,,,,,,,,,,,,,,,,,
"6. Churcher, C.S. 1978. Giraffidae. In Evolution of African Mammals (V.J. Maglio and H.B.S. Cooke, eds.), 509-535. Cambridge, MA: Harvard University Press.",,,,,,,,,,,,,,,,,,,,,,,,,
"7. Churcher, C.S. and Richardson, M.L. 1978. Equidae. In Evolution of African Mammals (V.J. Maglio and H.B.S. Cooke, eds.), 379-422. Cambridge, MA: Harvard University Press.",,,,,,,,,,,,,,,,,,,,,,,,,
"8. Alberdi, M.T., Prado, J.L., and Ortiz-Jaureguizar, E. 1995. Patterns of body size changes in fossil and living Equini (Perissodactyla). Biological Journal of the Linnean Society, 54: 349-370.",,,,,,,,,,,,,,,,,,,,,,,,,
"9. Stuart, A.J. 1999. Late Pleistocene megafaunal extinctions: A European perspective. In Extinctions in near time: causes, contexts, and consequences (R.D. E. MacPhee, ed.), 257-270. New York: Kluwer Academic/Plenum Press.",,,,,,,,,,,,,,,,,,,,,,,,,
"10. Stuart, A.J. 1991. Mammalian extinctions in the late Pleistocene of northern Eurasia and North America. Biological Reviews, 66:453-562. ",,,,,,,,,,,,,,,,,,,,,,,,,
"11. Martin, S. 1984. Prehistoric overkill: The global model. In Quaternary extinctions: a prehistoric revolution (S. Martin and R.G. Klein, eds.), 354-403. Tucson, AZ: University of Arizona Press.",,,,,,,,,,,,,,,,,,,,,,,,,
"12. Coppens, Y., Maglio, V.J., Madden, C.T. and Beden, M. 1978. Proboscidea. In Evolution of African Mammals (V.J. Maglio and H.B.S. Cooke, eds.), 336-367. Cambridge, MA: Harvard University Press.",,,,,,,,,,,,,,,,,,,,,,,,,
"13. Murray, 1984. Extinctions down under: A bestiary of extinct Australian Late Pleistocene Monotremes and Marsupials. In Quaternary extinctions: a prehistoric revolution (S. Martin and R.G. Klein, eds.), 600-628. Tucson, AZ: University of Arizona Press.",,,,,,,,,,,,,,,,,,,,,,,,,
"14. Ward, V.R. 2002. Prehistoric data files. (November 2002; www.angellis.net).",,,,,,,,,,,,,,,,,,,,,,,,,
"15. Keast, A., Erk, F.C., and Glass, B. 1972. Evolution, mammals, and southern continents, Albany : State University of New York Press.",,,,,,,,,,,,,,,,,,,,,,,,,
"16. Flannery, T.F. and Roberts, R.G. 1999. Late Quaternary extinctions in Australasia: A overview. In Extinctions in near time: causes, contexts, and consequences (R.D.E. MacPhee, ed.), 239-256. New York: Kluwer Academic/Plenum Press.",,,,,,,,,,,,,,,,,,,,,,,,,
"17. Smith, M.J. 1995. Toolache wallaby: Macropus greyi. In Mammals of Australia, Rev. Ed. (R. Strahan, ed.), 339-340. Washington D.C.: Smithsonian Institution Press.",,,,,,,,,,,,,,,,,,,,,,,,,
"18. Strahan, R. 1995. Eastern hare-wallaby: Lagorchestes leporides. In Mammals of Australia, Rev. Ed. (R. Strahan, ed.), 319-320. Washington D.C.: Smithsonian Institution Press.",,,,,,,,,,,,,,,,,,,,,,,,,
"19. Johnson, K.A. and Burbidge, A.A. 1995. Pig-footed bandicoot: Chaeropus ecaudatus. In Mammals of Australia, Rev. Ed. (R. Strahan, ed.), 170-171. Washington D. C.: Smithsonian Institution Press.",,,,,,,,,,,,,,,,,,,,,,,,,
"20. Smith, M.J. 1995. Desert rat-kangaroo: Caloprymnus campestris. In Mammals of Australia, Rev. Ed. (R. Strahan, ed.), 296-297. Washington D.C.: Smithsonian Institution Press.",,,,,,,,,,,,,,,,,,,,,,,,,
"21. Kitchener, D.J. 1995. Broad-faced potoroo: Potorous platyops. In Mammals of Australia, Rev. Ed. (R. Strahan, ed.), 300-301. Washington D.C.: Smithsonian Institution Press.",,,,,,,,,,,,,,,,,,,,,,,,,
"22. Wroe, S., Myers, T.J., Wells, R.T., and Gillespie, A. 1999. Estimating the weight of the Pleistocene marsupial lion, Thylacoleo carnifex (Thylacoleonidae: Marsupialia): implications for the ecomorphology of a marsupial super-predator and hypotheses of impoverishment of Australian marsupial carnivore faunas. Australian Journal of Zoology, 47: 489-498.",,,,,,,,,,,,,,,,,,,,,,,,,
"23. Grayson, D.K. 1993. The desert's past. A natural prehistory of the Great Basin, Washington, D.C.: Smithsonian Institution Press.",,,,,,,,,,,,,,,,,,,,,,,,,
"24. Graham, R.W. and Lundelius Jr., E.L. 1984. Coevolutionary disequilibrium and Pleistocene extinctions. In Quaternary extinctions: a prehistoric revolution (S. Martin and R.G. Klein, eds.), 223-249. Tucson, AZ: University of Arizona Press.",,,,,,,,,,,,,,,,,,,,,,,,,
"25. Kurtén, B. and Anderson, E. 1980. Pleistocene mammals of North America, Columbia, NY : Columbia University Press.",,,,,,,,,,,,,,,,,,,,,,,,,
"26. Murray, 1991. The Pleistocene megafauna of Australia. In Vertebrate palaeontology of Australasia ( Vickers-Rich, J.M. Mongahan, R.F. Baird, and T.H. Rich, eds.), 1070-1164. Melbourne: Pioneer Design Studio.",,,,,,,,,,,,,,,,,,,,,,,,,
"27. Scott, K. 1990. Postcranial dimensions of ungulates as predictors of body mass. In Body size in mammalian paleobiology: estimation and biological implications. (J. Damuth and B.J. MacFadden, eds.), 301-336. Cambridge: Cambridge University Press.",,,,,,,,,,,,,,,,,,,,,,,,,
"28. Alroy, J. 2002. North American fossil mammal systematics database. (January 2003; www.nceas.ucsb.edu/~alroy/nafmsd.html)",,,,,,,,,,,,,,,,,,,,,,,,,
29. George C. Page Museum. 2002. La Brea tar pits. (January 2002; www.tarpits.org),,,,,,,,,,,,,,,,,,,,,,,,,
30. FAUNMAP working grou 1994. FAUNMAP Database (October 2001; www.museum.state.il.us),,,,,,,,,,,,,,,,,,,,,,,,,
"31. Anyonge, W. 1993. Body mass in large extant and extinct carnivores. Journal of Zoology, London, 231: 339-350.",,,,,,,,,,,,,,,,,,,,,,,,,
"32. Kurtén, B. 1988. Before the Indians, New York: Columbia University Press.",,,,,,,,,,,,,,,,,,,,,,,,,
"33. Van Valkenburgh, B. 1991. Iterative evolution of hypercarnivory in canids (Mammalia: Carnivora): evolutionary interactions among sympatric predators. Paleobiology, 17: 340-362.",,,,,,,,,,,,,,,,,,,,,,,,,
"34. Burke, A. and Cinqmars, J. 1996. Dental characteristics of late Pleistocene Equus lambei from the Bluefish Caves, Yukon Territory, and their comparison with Eurasian horses. Geographie Physique et Quaternaire, 50: 81-93.",,,,,,,,,,,,,,,,,,,,,,,,,
"35. MacFadden, B.J. 1986. Fossil horses from ""Eohippus"" (Hyracotherium) to Equus: scaling, Cope's Law, and the evolution of body size. Paleobiology, 12: 355-369.",,,,,,,,,,,,,,,,,,,,,,,,,
"36. Haynes, G. 1991. Mammoths, mastodons and elephants: biology, behaviour and the fossil record, Cambridge: Cambridge University Press.",,,,,,,,,,,,,,,,,,,,,,,,,
"37. Burness, G., Diamond, J., and Flannery, T. 2001. Dinosaurs, dragons and dwarfs: the evolution of maximum body size. Proceedings of the National Academy of Sciences, 98: 14518-14523.",,,,,,,,,,,,,,,,,,,,,,,,,
"38. Roth, L. 1990. Insular dwarf elephants: A case study in body mass estimation and ecological inference. In Body size in mammalian paleobiology: estimation and biological implications. (J. Damuth and B.J. MacFadden, eds.), 151-180. Cambridge: Cambridge University Press.",,,,,,,,,,,,,,,,,,,,,,,,,
"40. Farina, R.A. 2002. in litt.",,,,,,,,,,,,,,,,,,,,,,,,,
"41. Martin, S. and Steadman, D.W. 1999. Prehistoric extinctions on islands and continents. In Extinctions in near time: causes, contexts, and consequences (R.D.E. MacPhee, ed.), 17-55. New York : Kluwer Academic/Plenum Press.",,,,,,,,,,,,,,,,,,,,,,,,,
"42. Berta, A. 1988. Quaternary evolution and biogeography of the large South American Canidae (Mammalia, Carnivora), Berkeley, CA: University of California Press.",,,,,,,,,,,,,,,,,,,,,,,,,
"43. Farina, R.A., Vizcaino, S.F., Bargo, M.S. Body mass estimations in Lujanian (late Pleistocene-early Holocene of South America) mammal megafauna. Unpublished manuscript",,,,,,,,,,,,,,,,,,,,,,,,,
"44. Prado, J.L. and Alberdi, M.A. 1994. A quantitative review of the horse Equus from South America. Palaeontology, 37: 459-481.",,,,,,,,,,,,,,,,,,,,,,,,,
"45. MacFadden, B.J. 1997. Pleistocene horses from Tarija, Boliva, and the validity of the genus Onohippidium (Mammalia: Equidae). Journal of Vertebrate Paleontology, 17: 199-218.",,,,,,,,,,,,,,,,,,,,,,,,,
"46. Cartelle, C., Hartwig, W.C. 1996. A new extinct primate among the Pleistocene megafauna of Bahia, Brazil. Proceedings of the National Academy of Sciences, 93: 6405-6409.",,,,,,,,,,,,,,,,,,,,,,,,,
"47. MacFadden, B.J. and Shockey, B.J. 1997. Ancient feeding ecology and niche differentiation of Pleistocene mammalian herbivores from Tarija, Bolivia: morphological and isotopic evidence. Paleobiology, 23: 77-100.",,,,,,,,,,,,,,,,,,,,,,,,,
"48. Cantalamessa G., Di Celma C., Bianucci G., Carnevale G., Coltorti M., Delfino M., Ficcarelli G., Espinosa M.M., Naldini D., Pieruccini , Ragaini L., Rook L., Rossi M., Tito G., Torre D., Valleri G., and Landini W. 2001. A new vertebrate fossiliferous site from the late Quaternary at San Jose on the north coast of Ecuador: preliminary note. Journal of South American Earth Sciences, 14: 331-334.",,,,,,,,,,,,,,,,,,,,,,,,,
"49. Marshall, L.G. 1994. L'Evolution et le contexte paleoecologique des faunes de mammiferes en amerique du sud pendant le Pleistocene. L'Anthropologie, 98: 55-80.",,,,,,,,,,,,,,,,,,,,,,,,,
"50. Lessa, E. and Farina, R.A. 1996. Reassessment of extinction patterns among the late Pleistocene mammals of South America. Palaeontology, 39: 651-662.",,,,,,,,,,,,,,,,,,,,,,,,,
"51. De Iuliis, G., Bargo, M.S., and Vizcaino, S.F. 2000. Variation in skull morphology and mastication in the fossil giant armadillos Pampatherium s and allied genera (Mammalia, Xenarthra, Pampatheriidae), with comments on their systematics and distribution. Journal of Vertebrate Paleontology, 20: 743-754.",,,,,,,,,,,,,,,,,,,,,,,,,
"52. Farina, R.A. and Vizcaino, S.F. 1997. Allometry of the bones of living and extinct armadillos (Xenarthra, Dasypoda). Z. Saugetierkunde, 62: 65-70.",,,,,,,,,,,,,,,,,,,,,,,,,
"53. Giacchino, A. And Gurovich, Y. 2002. Mamiferos gigantescos habitaron la region. (January 2002; Http://Www.Miramar-Digital.Com/Egatur/Museo/Mamgig.Html).",,,,,,,,,,,,,,,,,,,,,,,,,
"54. Guerin, C. and Faure, M. 2000. The real nature of Megatherium laurillardi LUND, 1842 (Mammalia, Xenarthra): a dwarf amongst giants. Geobios, 33: 475-488.",,,,,,,,,,,,,,,,,,,,,,,,,
"55. Bargo, M.S., Vizcaino, S.F., Archuby, F.M., and Blanco, R.E. 2000. Limb bone proportions, strength and digging in some Lujanian (Late Pleistocene-Early Holocene) mylodontid ground sloths (Mammalia, Xenarthra). Journal of Vertebrate Paleontology, 20: 601-610.",,,,,,,,,,,,,,,,,,,,,,,,,
"56. Nowak, R.M. 1999. Walker’s Mammals of the World. Volume 1 and 2. Baltimore: John Hopkins University Press.",,,,,,,,,,,,,,,,,,,,,,,,,
"57. Eisenberg, J.F. 1989. Mammals of the Neotropics. Volume 1. Chicago: University of Chicago Press.",,,,,,,,,,,,,,,,,,,,,,,,,
"58. Stuart, A.J. 1991. Mammalian extinctions in the late Pleistocene of northern Eurasia and North America. Biological Reviews of the Cambridge Philosophical Society, 66: 453-562.",,,,,,,,,,,,,,,,,,,,,,,,,
"59. Strahan, R. 1995. Mammals of Australia. Washington, D.C.: Smithsonian Institution Press.",,,,,,,,,,,,,,,,,,,,,,,,,
"60. Silva, M., and Downing, J.A. 1995. CRC Handbook of Mammalian Body Masses. Boca Raton: CRC Press.",,,,,,,,,,,,,,,,,,,,,,,,,
"61. Marquet, A., and Cofre, H. 1999. Large temporal and spatial scales in the structure of mammalian assemblages in South America: a macroecological approach. Oikos, 85:299-309.",,,,,,,,,,,,,,,,,,,,,,,,,
"62. Wilson, D.E., and Reeder, D.M. 1993. Mammal species of the world: a taxonomic and geographic reference, 2nd Edition. Washington, D.C.: Smithsonian Institution Press. ",,,,,,,,,,,,,,,,,,,,,,,,,
"63. Kingdon, J. 1982. East African mammals: an atlas of evolution in Africa, Volumes 1-3. Chicago: University of Chicago Press.",,,,,,,,,,,,,,,,,,,,,,,,,
"64. Yom Tov, pers. comm.",,,,,,,,,,,,,,,,,,,,,,,,,
"65. Haltenorth, T. and Diller, H. 1980. A field guide to the mammals of Africa including Madagascar. London: Collins.",,,,,,,,,,,,,,,,,,,,,,,,,
"66. Brown, J.H., and Nicoletto, F. 1991. Spatial scaling of species assemblages: body masses of North American land mammals. American Naturalist, 138:1478-1512.",,,,,,,,,,,,,,,,,,,,,,,,,
"67. Honacki, J.H., Kinman, K.E., and Koeppl, J.W. 1982. Mammal species of the world: a taxonomic and geographic reference. Lawrence: Allen Press.",,,,,,,,,,,,,,,,,,,,,,,,,
"68. Ernest, S. M. 2003. Life history characteristics of placental nonvolant mammals: ecological archives E084‐093. Ecology, 84(12), 3402-3402.",,,,,,,,,,,,,,,,,,,,,,,,,
"69. Damuth, J. 1987. Interspecific allometry of population density in mammals and other animals: the independence of body mass and population energy use. Biological Journal of the Linnean Society, 31:193-246.",,,,,,,,,,,,,,,,,,,,,,,,,
"70. Kingdon, J. 1997. The Kingdon field guide to African Mammals. San Diego: Academic Press.",,,,,,,,,,,,,,,,,,,,,,,,,
"71. Van den Bergh, M.B. and M. Kappelle. Unpublished manuscript. Diversity and distribution of small terrestrial rodents along a disturbance gradient and montane Costa Rica. (March 2003: http://rbt.ots.ac.cr/revistas/46-2/bergh.htm) ",,,,,,,,,,,,,,,,,,,,,,,,,
"72. Morand, S., Hafner, M.S., Page, R.D.M., and Reed, D.L. 2000. Comparative body size relationships in pocket gophers and their chewing lice. Biological Journal of the Linnean Society, 70:239-249.",,,,,,,,,,,,,,,,,,,,,,,,,
"73. Myers, 1995. The animal diversity web. (March 2003; http://animaldiversity.ummz.umich.edu)",,,,,,,,,,,,,,,,,,,,,,,,,
"74. Harvey, H. and Cluttonbrock, T.H. 1985. Life-history variation in primates. Evolution, 39:559-581",,,,,,,,,,,,,,,,,,,,,,,,,
"75. Wootten, J.T. 1987. The effects of body-mass, phylogeny, habitat, and trophic level on mammalian age at 1st reproduction. Evolution, 41:732-749.",,,,,,,,,,,,,,,,,,,,,,,,,
"76. Jones, J. Knox Jr., and Baldassarre, G.A. 1982. Reithrodontyomys brevirostris and Reithrodontomys paradoxus. Mammalian Species, 192:1-3. ",,,,,,,,,,,,,,,,,,,,,,,,,
"77. Jones, J. Knox Jr. 1982. Reithrodontomys spectabilis. Mammalian Species, 192:1. ",,,,,,,,,,,,,,,,,,,,,,,,,
"78. Palmeirim, J.M. and Hoffmann, R.S. 1983. Galemys pyrenaicus. Mammalian Species, 207:1-5.",,,,,,,,,,,,,,,,,,,,,,,,,
"79. Nagorsen, D. 1985. Kogia simus. Mammalian Species, 239:1-6. ",,,,,,,,,,,,,,,,,,,,,,,,,
"80. Wang, X. and Hofmann, R.S. 1987. Pseudois nayaur and Pseudois schaeferi. Mammalian Specie,s 278:1-6.",,,,,,,,,,,,,,,,,,,,,,,,,
"81. Jones, J. Knox. Jr. 1990. Peromyscus stirtoni. Mammalian Species, 361:1-2. ",,,,,,,,,,,,,,,,,,,,,,,,,
"82. Youngman, M. 1990. Mustela lutreola. Mammalian Species, 362:1-3.",,,,,,,,,,,,,,,,,,,,,,,,,
"83. Baumgardner, G.D. 1991. Dipodomys compactus. Mammalian Species, 369:1-4.",,,,,,,,,,,,,,,,,,,,,,,,,
"84. Best, T.L. and Thomas, H.H. 1991. Dipodomys insularis. Mammalian Species, 374:1-3.",,,,,,,,,,,,,,,,,,,,,,,,,
"85. Van Rompaey, H. and Colyn, M. 1992. Crossarchus ansorgei. Mammalian Species, 402:1-3",,,,,,,,,,,,,,,,,,,,,,,,,
"86. Best, T.L., Bartig, J.L., and Burt, S.L. 1992. Tamias canipes. Mammalian Species, 411:1-5.",,,,,,,,,,,,,,,,,,,,,,,,,
"87. Heath, M.E. 1992. Manis pentadactyla. Mammalian Species, 414:1-6.",,,,,,,,,,,,,,,,,,,,,,,,,
"88. Jefferson, T.A. and Newcomer, M.W. 1993. Lissodelphis borealis. Mammalian Species, 425:1-6",,,,,,,,,,,,,,,,,,,,,,,,,
"89. Best, R.C. and da Silva, V.M.F. 1993. Inia geoffrensis. Mammalian Species, 426:1-8",,,,,,,,,,,,,,,,,,,,,,,,,
"90. Burt, S.L. and Best. T.L. 1994. Tamias rufus. Mammalian Species, 460:1-6.",,,,,,,,,,,,,,,,,,,,,,,,,
"91. Kingswood, S.C. and Blank, D.A. 1996. Gazella subgutturosa. Mammalian Species, 518:1-10. ",,,,,,,,,,,,,,,,,,,,,,,,,
"92. Custodio, C.C., Lepiten, M.V. and Heaney, L.R. 1996. Bubalus mindorensis. Mammalian Species, 520:1-5",,,,,,,,,,,,,,,,,,,,,,,,,
"93. Newcomer, M.W., Jefferson, T.A., and Brownell, R.L. Jr. 1996. Lissodephis peronii. Mammalian Species, 531:1-5",,,,,,,,,,,,,,,,,,,,,,,,,
"94. Garcia-Perea, R. Ventura, J., Lopez-Fuster, J. and Gisbert, J. 1997. Soxes granarius. Mammalian Species, 554:1-4.",,,,,,,,,,,,,,,,,,,,,,,,,
"95. Sokolov, V.E. and Lushchekina, A.A. 1997. Procrapa gutterosa. Mammalian Species, 571:1-5",,,,,,,,,,,,,,,,,,,,,,,,,
"96. Lariviere, S. 1998. Lontra felina. Mammalian Species, 575:1-5",,,,,,,,,,,,,,,,,,,,,,,,,
"97. Adam, M.D. and Hayes, J. 1998. Arborimus pomo. Mammalian Species, 593:1-5.",,,,,,,,,,,,,,,,,,,,,,,,,
"98. Alvarez-Castaneda, S.T. and Yensen, E. 1999. Neotoma bryanti. Mammalian Species, 619:1-3",,,,,,,,,,,,,,,,,,,,,,,,,
"99. Norris, C.A. 1999. Phalanger lullulae. Mammalian Species, 620:1-4",,,,,,,,,,,,,,,,,,,,,,,,,
"100. Mead, J.I. and Nadachowski, A. 1999. Alticola stoliczkanus. Mammalian Species, 624:1-4.",,,,,,,,,,,,,,,,,,,,,,,,,
"101. Storz, J.F. and Wozencraft. W.C. 1999. Melogale moschata. Mammalian Species, 631:1-4",,,,,,,,,,,,,,,,,,,,,,,,,
"102. Cortes-Calva, , Alvarez-Castaneda, S.T., and Yensen, E. 2001. Neotoma anthonyi. Mammalian Species, 663:1-3",,,,,,,,,,,,,,,,,,,,,,,,,
"103. McCay, T. S. 2001. Blarina carolinensis. Mammalian Species, 673:1-7.",,,,,,,,,,,,,,,,,,,,,,,,,
"104. Fedosenko, A.K. and Blank, D.A. 2001. Capra sibirica. Mammalian Species, 675:1-13",,,,,,,,,,,,,,,,,,,,,,,,,
"105. Belcher, R.L. and Lee, T, Jr. 2002. Arctocephalus townsendi. Mammalian Species, 700:1-5.",,,,,,,,,,,,,,,,,,,,,,,,,
"106. Stuart, C. and Stuart, T. 1988. Field guide to the mammals of Southern Africa. London: New Holland Publishers. ",,,,,,,,,,,,,,,,,,,,,,,,,
"107. Dorst, J. 1969. A field guide to the larger mammals of Africa. Boston: Houghton Mifflin Company.",,,,,,,,,,,,,,,,,,,,,,,,,
"108. Kingdon, J. 1984. East African mammals. Volume IIA. Insectivores and Bats. Chicago: University of Chicago Press. ",,,,,,,,,,,,,,,,,,,,,,,,,
"109. Kingdon, J. 1984. East African mammals. Volume IIB. Hares and Rodents. Chicago: University of Chicago Press.",,,,,,,,,,,,,,,,,,,,,,,,,
"110. Flannery, T. 1995. Mammals of the Southwest Pacific and Moluccan Islands. New York: Cornell University Press.",,,,,,,,,,,,,,,,,,,,,,,,,
"111. Van Den Brink, F.H. 1968. A field guide to the mammals of Britain and Europe. Boston: Houghton Mifflin Company Boston. ",,,,,,,,,,,,,,,,,,,,,,,,,
"112. Stuart, A. J. 1999. In Extinctions in near time: causes, contexts, and consequences (R.D.E. MacPhee, ed.), 257-270. New York: Kluwer Academic/Plenum Press.",,,,,,,,,,,,,,,,,,,,,,,,,
"113. Lynch, C.D. 1994. The mammals of Lesotho. Navorsinge: Van Die Nasionale Museum Bloemfontein. (Journal of the National Museum, Bloemfontein) 10:1- 241.",,,,,,,,,,,,,,,,,,,,,,,,,
"114. Krystufek, Boris. 1991. Sesalci Slovenije. Slovenije: Prirodoslovni muzej Slovenije.",,,,,,,,,,,,,,,,,,,,,,,,,
"115. Prater, S.H. 1971. The book of Indian animals. Bombay Natural History Society. Oxford: Oxford University Press. ",,,,,,,,,,,,,,,,,,,,,,,,,
"116. Kingdon, J. 1982. Ostafrikanische Säugetiere. Frankfurt: Senckenbergische Naturforschende Gesellschaft.",,,,,,,,,,,,,,,,,,,,,,,,,
"117. Roberts, T.J. 1977. The mammals of Pakistan. London: Ernest Benn Limited",,,,,,,,,,,,,,,,,,,,,,,,,
"118. Payne, J., Frances, C.M., and Phillipps, K. 1985. A field guide to the mammals of Borneo. Kuala Lumpur: The Sabah Society with World Wildlife Fund Malaysia.",,,,,,,,,,,,,,,,,,,,,,,,,
"119. Harrison, J. 1966. An introduction to the mammals of Singapore and Malaya. Malayan Nature Society. Singapore: Tien Wah Press.",,,,,,,,,,,,,,,,,,,,,,,,,
"120. Marshall, 1967. Wild mammals of Hong Kong. Oxford: Oxford University Press.",,,,,,,,,,,,,,,,,,,,,,,,,
"121. Heaney, L.R., Balete, D.S., Rickart, E.A., Utzurrum, R.C.B., and Gonzales, C. 1999. Mammalian diversity on Mount Isarog, a threatened center of endemism of souther Luzon Island, Philippines. Fieldiana, 95: 1-62.",,,,,,,,,,,,,,,,,,,,,,,,,
"122. Rickart, E.A., Heaney, L.R., Heideman, D., Utzurrum, R.C.B. 1993. The distribution and ecology of mammals on Leyte, Biliran, and Maripipi Islands, Philippines. Fieldiana, 72:1-62.",,,,,,,,,,,,,,,,,,,,,,,,,
"123. Shukor, M.N. 1996. The mammalian fauna on the islands at the northern tip of Sabah, Borneo. Fieldiana, 83:1-51.",,,,,,,,,,,,,,,,,,,,,,,,,
"124. Stanley, W.T., Goodman, S.M., and Hutterer, R. 1996. Notes on the insectivores and elephant shrews of the Chome Forest, South Pare Mountains, Tanzania (Mammalia: Insectivora et Macroscelidea). Zoologische Abhandlungen: Staatliches Museum fur Tierkunde Dresden, 49:131-147.",,,,,,,,,,,,,,,,,,,,,,,,,
"125. Stanley, W.T., Goodman, S.M., and Kihaule, M. 1998. Results of two surveys of rodents in the Chome Forest Reserve, South Pare Mountains, Tanzania (Mammalia: Rodentia). Zoologische Abhandlungen: Staatliches Museum fur Tierkunde Dresden, 50:145-160.",,,,,,,,,,,,,,,,,,,,,,,,,
"126. Stanley, W.T. and Hutterer, R. 2000. A new species of Myosorex Gray, 1832 (Mammalia: Soricidae) from the Eastern Arc mountains, Tanzania. Bonner Zoologische Beiträge, 49:19-29.",,,,,,,,,,,,,,,,,,,,,,,,,
"127. Stanley, W.T., Goodman, S.M., Kihaule, M., and Howell, K.M. 2000. A survey of the small mammals of the Gonja forest reserve, Tanzania. Journal of East African Natural History, 89:73-83",,,,,,,,,,,,,,,,,,,,,,,,,
"128. Osborn, D.J., and Helmy, I. 1980. The contemporary land mammals of Egypt (including Sinai). Fieldiana, 5:1-579.",,,,,,,,,,,,,,,,,,,,,,,,,
"129. Smithers, R.H.N. 1983. The mammals of the southern African subregion. Pretoria: University of Pretoria Press.",,,,,,,,,,,,,,,,,,,,,,,,,
"130. Happold, D.C.D. 1987. The mammals of Nigeria. Oxford: Clarendon Press.",,,,,,,,,,,,,,,,,,,,,,,,,
"131. Pocock, R.I. 1941. The fauna of British India, including Ceylon and Burma. Mammalia. Volume II. Carnivora. London: Taylor and Francis, Ltd.",,,,,,,,,,,,,,,,,,,,,,,,,
"132. Phillips, W.W.A. 1935. Manual of the mammals of Ceylon. London: Dulau and Company, Ltd.",,,,,,,,,,,,,,,,,,,,,,,,,
"133. Blandford, W.T. 1891. The fauna of British India, including Ceylon and Burma. London: Taylor and Francis, Ltd.",,,,,,,,,,,,,,,,,,,,,,,,,
"134. MacDonald, D.W., Barrett, McDonald, D. 1993. Mammals of Britain and Europe. London: Harper and Collins.",,,,,,,,,,,,,,,,,,,,,,,,,
"135. Delany, M.J. 1975. The Rodents of Uganda. British Museum of Natural History Publication No. 764, Kettering: Staples Printers Ltd.",,,,,,,,,,,,,,,,,,,,,,,,,
"136. 1990. Grzimek's Encylopedia of Mammals, Volume 5. New York: Mcgraw Hill. ",,,,,,,,,,,,,,,,,,,,,,,,,
"136. 1990. Grzimek's Encylopedia of Mammals, Volume 5. New York: Mcgraw Hill. ",,,,,,,,,,,,,,,,,,,,,,,,,
"136. 1990. Grzimek's Encylopedia of Mammals, Volume 5. New York: Mcgraw Hill. ",,,,,,,,,,,,,,,,,,,,,,,,,
"136. 1990. Grzimek's Encylopedia of Mammals, Volume 5. New York: Mcgraw Hill. ",,,,,,,,,,,,,,,,,,,,,,,,,
"136. 1990. Grzimek's Encylopedia of Mammals, Volume 5. New York: Mcgraw Hill. ",,,,,,,,,,,,,,,,,,,,,,,,,
"141. Macdonald, D. 1985. The Encyclopedia of Mammals. New York: Facts on File Publications.",,,,,,,,,,,,,,,,,,,,,,,,,
"142. Medway, L. 1969. The wild mammals of Malaya and offshore islands including Singapore. London: Oxford University Press.",,,,,,,,,,,,,,,,,,,,,,,,,
"143. Furley, C.W. 1983. Potential Use of Gazelles for Game Ranching in the Arabian Peninsula. Lecture was delivered at the Agro-Gulf Exhibition and Conference, Abu Dhabi. (March 2003; http://enhg5.4t.com/b/b22/22_06.htm)",,,,,,,,,,,,,,,,,,,,,,,,,
144. Thai Society for the Conservation of Wild Animals. 2002. (March 2003; http://www.tscwa.org/wildlife/rare_or_extinct_09.html),,,,,,,,,,,,,,,,,,,,,,,,,
"145. Mc Farlane, D.A. 1999. Late quaternary fossil mammals and last occurrence dates from caves at Barahona, Puerto Rico. Caribbean Journal of Science, 35:238-248",,,,,,,,,,,,,,,,,,,,,,,,,
"146. Woodland Park Zoo, Seattle, WA. 2002. Woodland Park Zoo – Animal fact sheets. (March 2003; http://www.zoo.org/educate/fact_sheets).",,,,,,,,,,,,,,,,,,,,,,,,,
"147. Whitehead, K.G. 1993. The Whitehead Encyclopedia of Deer. Stillwater: Voyageur Press, Inc.",,,,,,,,,,,,,,,,,,,,,,,,,
"148. Kappeler, M., and Pereira, M.A., eds. 2003. Primate life histories and socioecology. Chicago: University of Chicago Press.",,,,,,,,,,,,,,,,,,,,,,,,,
"149. Bennet, D. and Hoffman, R.S. 1999. Equus callabus. Mammalian Species, 628:1-14.",,,,,,,,,,,,,,,,,,,,,,,,,
"150. Garbutt, M. 1999. Mammals of Madagascar. New Haven: Yale University Press.",,,,,,,,,,,,,,,,,,,,,,,,,
"151. Flannery, T. 1995. Mammals of New Guinea: Ithaca: Cornell Unversity Press.",,,,,,,,,,,,,,,,,,,,,,,,,
"152. Verts, B.J., and Carraway, L.N. 1998. Land mammals of Oregon. Berkeley: University of California Press. ",,,,,,,,,,,,,,,,,,,,,,,,,
"153. Jones, K.E., Purvis, A., and Gittleman, J.L. 2003. Biological correlates of extinction risk in bats. American Naturalist, 161:601-614.",,,,,,,,,,,,,,,,,,,,,,,,,
"154. Link Olson, 2002. in litt.",,,,,,,,,,,,,,,,,,,,,,,,,
"155. MacPhee, R.D.E. 1994. Morphology, adaptations, and relationships of Plesiorycteropus, and a diagnosis of a new order of Eutherian mammals. Bulletin of the American Museum of Natural History, 220:1-214.",,,,,,,,,,,,,,,,,,,,,,,,,
